<?xml version="1.0"?>
<!--address book using nested elements-->
<address_book_nested xmlns:xsi="http://www.w3.org/2001/XMLSchema-instance" xsi:noNamespaceSchemaLocation="address_book_nested.xsd">
	<record ID="1">
		<name>
			<first_name>first name</first_name>
			<middle_name>middle name</middle_name>
			<last_name>last name</last_name>
			<nick_name>nick name</nick_name>
		</name>
		<address>
			<street_address>street address goes here</street_address>
			<street_address_detail>apartment number goes here</street_address_detail>
			<city>city goes here</city>
			<state>state goes here</state>
			<zipcode>zipcode goes here</zipcode>
		</address>
		<contact>
			<home_phone>home phone goes here</home_phone>
			<work_phone>work phone goes here</work_phone>
			<cell_phone>cell phone goes here</cell_phone>
			<fax_number>fax number goes here</fax_number>
			<email_address>email address goes here</email_address>
		</contact>
		<comments>
			<misc_comments>comments go here</misc_comments>
		</comments>
	</record>
	<record ID="2">
		<name>
			<first_name>first name</first_name>
			<middle_name>middle name</middle_name>
			<last_name>last name</last_name>
			<nick_name>nick name</nick_name>
		</name>
		<address>
			<street_address>street address goes here</street_address>
			<street_address_detail>apartment number goes here</street_address_detail>
			<city>city goes here</city>
			<state>state goes here</state>
			<zipcode>zipcode goes here</zipcode>
		</address>
		<contact>
			<home_phone>home phone goes here</home_phone>
			<work_phone>work phone goes here</work_phone>
			<cell_phone>cell phone goes here</cell_phone>
			<fax_number>fax number goes here</fax_number>
			<email_address>email address goes here</email_address>
		</contact>
		<comments>
			<misc_comments>comments go here</misc_comments>
		</comments>
	</record>
	<record ID="3">
		<name>
			<first_name>first name</first_name>
			<middle_name>middle name</middle_name>
			<last_name>last name</last_name>
			<nick_name>nick name</nick_name>
		</name>
		<address>
			<street_address>street address goes here</street_address>
			<street_address_detail>apartment number goes here</street_address_detail>
			<city>city goes here</city>
			<state>state goes here</state>
			<zipcode>zipcode goes here</zipcode>
		</address>
		<contact>
			<home_phone>home phone goes here</home_phone>
			<work_phone>work phone goes here</work_phone>
			<cell_phone>cell phone goes here</cell_phone>
			<fax_number>fax number goes here</fax_number>
			<email_address>email address goes here</email_address>
		</contact>
		<comments>
			<misc_comments>comments go here</misc_comments>
		</comments>
	</record>
	<record ID="4">
		<name>
			<first_name>first name</first_name>
			<middle_name>middle name</middle_name>
			<last_name>last name</last_name>
			<nick_name>nick name</nick_name>
		</name>
		<address>
			<street_address>street address goes here</street_address>
			<street_address_detail>apartment number goes here</street_address_detail>
			<city>city goes here</city>
			<state>state goes here</state>
			<zipcode>zipcode goes here</zipcode>
		</address>
		<contact>
			<home_phone>home phone goes here</home_phone>
			<work_phone>work phone goes here</work_phone>
			<cell_phone>cell phone goes here</cell_phone>
			<fax_number>fax number goes here</fax_number>
			<email_address>email address goes here</email_address>
		</contact>
		<comments>
			<misc_comments>comments go here</misc_comments>
		</comments>
	</record>
	<record ID="5">
		<name>
			<first_name>first name</first_name>
			<middle_name>middle name</middle_name>
			<last_name>last name</last_name>
			<nick_name>nick name</nick_name>
		</name>
		<address>
			<street_address>street address goes here</street_address>
			<street_address_detail>apartment number goes here</street_address_detail>
			<city>city goes here</city>
			<state>state goes here</state>
			<zipcode>zipcode goes here</zipcode>
		</address>
		<contact>
			<home_phone>home phone goes here</home_phone>
			<work_phone>work phone goes here</work_phone>
			<cell_phone>cell phone goes here</cell_phone>
			<fax_number>fax number goes here</fax_number>
			<email_address>email address goes here</email_address>
		</contact>
		<comments>
			<misc_comments>comments go here</misc_comments>
		</comments>
	</record>
</address_book_nested>
